{
  "id": "coordinate_systems",
  "title": "Interaktives Tutorial zum Thema Koordinatensysteme",
  "next_level": null,
  "elements": [
    {
      "type": "interactive",
      "entrypoint": "main.js"
    },
    {
      "type": "button",
      "text": "Start",
      "url": "https://scratch.mit.edu/projects/editor"
    }
  ]
}
